{
  "approvalVersion": "0.2.0",
  "approvalId": "approval_cad_multispace_seed_001",
  "canonicalizationPolicy": "cad-scene-seed-policy-v0.2",
  "decision": "approved_as_is",
  "reviewedPartitionModel": {
    "reviewedPartitionModelVersion": "0.1.0",
    "reviewedPartitionModelHash": "sha256:3f57213e3260437b21cc354efd1d6ed3c79bae9597ca92fe2fce59a41d8be017",
    "partitionPolicyVersion": "cad-shared-partition-policy-v0.1",
    "architecturalTopologyHash": "sha256:d8be5d08652116e14a7f959adf3efcd80148c7615661d2a7448fce68f74c2f59",
    "candidateBasis": "space_wall_stage",
    "sourceHash": "sha256:6de69c56aac4cdc9e98f1a658c62974e4af8e53aff9f19382d352b7143fcab9e",
    "cadDocumentHash": "sha256:7cdd0a8b9d47a74bc57edec6449594d59c4c46682b568c141475f9e84a3aaf29",
    "profileHash": "sha256:120a33f5919cbc03a0c0f7db42f0770cca9645d8bfd4348d8012f269d5b63f39",
    "spaceWallStageHash": "sha256:ab13a1ac0eed9d9deec986e78bb14bbe6b04aa7119467488184a76ac3083a81a",
    "architecturalExtractionHash": null
  },
  "canonical": {
    "project": {
      "id": "project_cad_multispace_001",
      "name": "CAD Multi-Space Two Room"
    },
    "scene": {
      "id": "scene_cad_multispace_001",
      "revisionId": "rev_cad_multispace_0001",
      "createdAt": "2026-09-29T12:00:00Z"
    }
  },
  "lockPolicy": "all_unlocked",
  "mappings": {
    "levels": [
      {
        "candidateId": "level_candidate_ground",
        "logicalId": "level_ground"
      }
    ],
    "spaces": [
      {
        "candidateId": "space_candidate_0000",
        "logicalId": "space_living_main",
        "floorSurfaceId": "surface_floor_living",
        "ceilingSurfaceId": "surface_ceiling_living"
      },
      {
        "candidateId": "space_candidate_0001",
        "logicalId": "space_bedroom_main",
        "floorSurfaceId": "surface_floor_bedroom",
        "ceilingSurfaceId": "surface_ceiling_bedroom"
      }
    ],
    "walls": [
      {
        "candidateId": "unpaired_wall_segment_wall_candidate_0000_0000_0000",
        "logicalId": "wall_living_south"
      },
      {
        "candidateId": "unpaired_wall_segment_wall_candidate_0000_0002_0000",
        "logicalId": "wall_living_north"
      },
      {
        "candidateId": "unpaired_wall_segment_wall_candidate_0000_0003_0000",
        "logicalId": "wall_living_west"
      },
      {
        "candidateId": "unpaired_wall_segment_wall_candidate_0001_0000_0000",
        "logicalId": "wall_bedroom_south"
      },
      {
        "candidateId": "unpaired_wall_segment_wall_candidate_0001_0001_0000",
        "logicalId": "wall_bedroom_east"
      },
      {
        "candidateId": "unpaired_wall_segment_wall_candidate_0001_0002_0000",
        "logicalId": "wall_bedroom_north"
      }
    ],
    "partitions": [
      {
        "candidateId": "partition_candidate_0000",
        "logicalId": "partition_living_bedroom_main"
      }
    ],
    "openings": [
      {
        "candidateId": "topology_opening_0000",
        "logicalId": "opening_d_internal_01"
      }
    ]
  },
  "nonCadState": {
    "sources": [
      {
        "id": "source_cad_multispace_dxf",
        "type": "dxf",
        "uri": "urn:sha256:6de69c56aac4cdc9e98f1a658c62974e4af8e53aff9f19382d352b7143fcab9e",
        "authority": "A3",
        "confidence": 1,
        "verified": true
      }
    ],
    "assetDefinitions": [
      {
        "id": "assetdef_multispace_box_v1",
        "version": "1",
        "category": "coffee_table",
        "sourceType": "procedural_proxy",
        "dimensions": [
          600,
          400,
          450
        ],
        "pivotPolicy": "floor_center",
        "allowNonUniformScale": false
      }
    ],
    "assets": [
      {
        "id": "asset_multispace_box_bedroom",
        "type": "proxy_asset",
        "assetDefinitionId": "assetdef_multispace_box_v1",
        "spaceId": "space_bedroom_main",
        "transform": {
          "position": [
            5000,
            1000,
            0
          ],
          "rotationEuler": [
            0,
            0,
            0
          ],
          "scale": [
            1,
            1,
            1
          ]
        },
        "locks": {
          "geometry": false,
          "transform": false,
          "material": false
        }
      },
      {
        "id": "asset_multispace_box_living",
        "type": "proxy_asset",
        "assetDefinitionId": "assetdef_multispace_box_v1",
        "spaceId": "space_living_main",
        "transform": {
          "position": [
            1000,
            1000,
            0
          ],
          "rotationEuler": [
            0,
            0,
            0
          ],
          "scale": [
            1,
            1,
            1
          ]
        },
        "locks": {
          "geometry": false,
          "transform": false,
          "material": false
        }
      }
    ],
    "materials": [],
    "materialAssignments": [],
    "lights": [],
    "cameras": [
      {
        "id": "camera_multispace_living_a",
        "type": "camera",
        "spaceId": "space_living_main",
        "transform": {
          "position": [
            1200,
            3800,
            1500
          ],
          "rotationEuler": [
            -2.84471,
            0,
            206.565051
          ],
          "scale": [
            1,
            1,
            1
          ]
        },
        "target": [
          3000,
          200,
          1300
        ],
        "orientationPolicy": "look_at_target",
        "focalLengthMm": 28,
        "sensorWidthMm": 36
      }
    ],
    "render": {
      "engine": "none",
      "mode": "build_only"
    },
    "circulationRequirements": []
  }
}
